{"schemaVersion":1,"guest":{"os":"darwin","arch":"arm64","osVersion":"26.0","osBuild":"25A354","variant":"base"},"firmware":{"type":"apple","secureBoot":false,"tpm":"none","hardwareModel":"aHc=","minHostOS":"15.0"},"disks":[{"name":"disk0","role":"system","logicalSize":68824334336,"chunkSize":536870912,"chunkCount":129,"compression":"zstd","zeroChunks":3}],"state":[{"name":"auxstorage","mediaType":"application/vnd.weave.guest.state.auxstorage.v1","semantics":"carry","required":true}],"resources":{"cpu":{"min":2,"default":4},"memory":{"min":4294967296,"default":8589934592}},"provisioning":{"defaultUser":"admin","credentialHint":"set-at-first-boot","agent":{"name":"weave-agent","version":"0.2.0"}},"build":{"template":"macos-26-base","templateRef":"weaveplatform/weaveplatform-oci@0123abc","sourceMedia":[{"kind":"ipsw","uri":"https://updates.cdn-apple.com/UniversalMac_26.0_25A354_Restore.ipsw","digest":"sha256:0000000000000000000000000000000000000000000000000000000000000001"}],"created":"2026-10-02T08:00:00Z"}}