{"schemaVersion":1,"guest":{"os":"windows","arch":"amd64","osVersion":"10.0.26200.6584","osBuild":"26200.6584","edition":"Pro","variant":"base"},"firmware":{"type":"uefi","secureBoot":true,"tpm":"required"},"disks":[{"name":"disk0","role":"system","logicalSize":68824334336,"chunkSize":536870912,"chunkCount":129,"compression":"zstd","zeroChunks":3}],"state":[{"name":"uefivars","mediaType":"application/vnd.weave.guest.state.uefivars.v1","semantics":"carry","required":false},{"name":"firmware-policy","mediaType":"application/vnd.weave.guest.state.firmware-policy.v1+json","semantics":"regenerate","required":true}],"resources":{"cpu":{"min":2,"default":4},"memory":{"min":4294967296,"default":8589934592}},"provisioning":{"defaultUser":"admin","credentialHint":"set-at-first-boot","agent":{"name":"weave-agent","version":"0.2.0"}},"build":{"template":"windows-11-base","templateRef":"weaveplatform/weaveplatform-oci@0123abc","sourceMedia":[{"kind":"iso","uri":"https://software.download.prss.microsoft.com/Win11_25H2_English_x64.iso","digest":"sha256:0000000000000000000000000000000000000000000000000000000000000001"}],"created":"2026-10-02T08:00:00Z"}}