{"schemaVersion":1,"guest":{"os":"linux","arch":"arm64","osVersion":"24.04","osBuild":"20260915","distro":"ubuntu"},"firmware":{"type":"uefi","secureBoot":false,"tpm":"none"},"disks":[{"name":"disk0","role":"system","logicalSize":68824334336,"chunkSize":536870912,"chunkCount":129,"compression":"zstd","zeroChunks":3}],"state":[],"resources":{"cpu":{"min":2,"default":4},"memory":{"min":4294967296,"default":8589934592}},"provisioning":{"credentialHint":"cloud-init","agent":{"name":"weave-agent","version":"0.2.0"}},"build":{"template":"ubuntu-24.04","templateRef":"weaveplatform/weaveplatform-oci@0123abc","sourceMedia":[{"kind":"cloud-image","uri":"https://cloud-images.ubuntu.com/noble/20260915/noble-server-cloudimg-arm64.img","digest":"sha256:0000000000000000000000000000000000000000000000000000000000000001"}],"created":"2026-10-02T08:00:00Z"}}